,account_created_at,account_lang,country_code,created_at,favourites_count,followers_count,friends_count,is_quote,is_retweet,label,lang,place_full_name,place_type,reply_to_screen_name,reply_to_status_id,reply_to_user_id,retweet_count,screen_name,source,status_id,text,user_id,verified
148,2013-04-18T23:33:52Z,,AU,2020-03-15T20:49:15Z,95.0,45.0,232.0,0.0,0.0,2.0,en,"Melbourne, Victoria",city,,,,1.0,TennilleSanders,Twitter for iPhone,1.2392926021317059e+18,"An extremely heavy and hard day in Italy with an increase in #COVIDー19 deaths by 368 in just one day! What hell they must be enduring, spare a thought for someone who is really struggling with #coronavirus whilst we Australians storm the shops thinking only of ourselves.",1363142564.0,0.0
149,2011-11-16T18:31:52Z,,,2020-03-15T00:51:08Z,2460.0,4043.0,153.0,0.0,0.0,2.0,en,,,,,,22.0,_EamonnOReilly,Twitter for iPhone,1.2389910835829965e+18,Like many others who decided to close today because of #COVID19 I debated with myself back &amp; forth for days. As difficult as it was I’m so glad now that I did it I’ll sleep a bit easier tonight. Do the right thing for everyone #closethepubs #closetherestaurants #LockdownIreland,414170851.0,0.0
150,2018-10-01T20:05:42Z,,,2020-03-15T16:15:58Z,159.0,64.0,130.0,0.0,0.0,1.0,en,,,,,,0.0,america85119358,Twitter for iPhone,1.2392238261411185e+18,It’s too bad that the mainstream media has ruined its credibility at a time when most Americans need fair news reporting on a very serious topic.  #COVIDー19 #coronapocolypse #coronavirus #media,1.0468536854044262e+18,0.0
151,2014-09-10T04:19:52Z,,,2020-03-15T12:42:26Z,11431.0,212.0,101.0,0.0,0.0,2.0,en,,,,,,0.0,ahmadrasool_,Twitter for Android,1.2391700879925985e+18,"The role of #China in anti-corona measures is marvellous. World must learn from China how to control #CoronavirusOutbreak , instead of blaming each other. This is a pandemic and countries need to take serious steps!!

#CoronavirusPandemic",2801045118.0,0.0
152,2016-01-24T14:56:53Z,,,2020-03-15T18:23:10Z,4561.0,124.0,208.0,0.0,0.0,2.0,en,,,sophiakdiaz,1.23925519404868e+18,4842165357.0,0.0,sophiakdiaz,Twitter for iPhone,1.2392558372703478e+18,"because while you may be fine if you get coronavirus, you could come in contact with someone who it could be deadly for them. stay in your house!! only leave if absolutely necessary!! while we need to have caution don’t freak out &amp; but 72 cases of hand sanitizer. #coronavirus",4842165357.0,0.0
